- Создать таблицы, соответствующие иерархии из вашей диаграммы
классов.

mysql> CREATE DATABASE HumanFriends;
Query OK, 1 row affected (0,00 sec)

mysql> use HumanFriends;

mysql> Create TABLE Pets (id INT, Name VARCHAR(50),Type VARCHAR(50), BirthDate DATE, Commands VARCHAR(250));
Query OK, 0 rows affected (0,02 sec)

mysql> Create TABLE PackAnimals (id INT, Name VARCHAR(50),Type VARCHAR(50), BirthDate DATE, Commands VARCHAR(250));
Query OK, 0 rows affected (0,03 sec)


- Заполнить таблицы данными о животных, их командах и датами
рождения.

mysql> INSERT INTO Pets (id,Name,Type,BirthDate,Commands) VALUES (1,'Fido','Dog','2020-01-01','Sit,StayFetch'),(2,'Barsik','Cat','2019-05-15','Sit,Stay'),(3,'Begun','Hamster'
,'2021-12-10','Sit'),(4,'Smudge','Cat','2020-02-20','Sit,Pounce');
Query OK, 4 rows affected (0,01 sec)
Records: 4  Duplicates: 0  Warnings: 0



mysql> INSERT INTO PackAnimals (id,Name,Type,BirthDate,Commands) VALUES (1,'Thunder','Horse','2015-01-01','Trot,Canter'),(2,'Sandy','Camel','2016-05-15','Walk,Sit'),(3,'Dune','Camel'
,'2018-12-10','Sit'),(4,'Burro','Donkey','2019-02-20','Sit,Pounce,Walk');
Query OK, 4 rows affected (0,01 sec)
Records: 4  Duplicates: 0  Warnings: 0




mysql> select * from Pets;
+------+--------+---------+------------+---------------+
| id   | Name   | Type    | BirthDate  | Commands      |
+------+--------+---------+------------+---------------+
|    1 | Fido   | Dog     | 2020-01-01 | Sit,StayFetch |
|    2 | Barsik | Cat     | 2019-05-15 | Sit,Stay      |
|    3 | Begun  | Hamster | 2021-12-10 | Sit           |
|    4 | Smudge | Cat     | 2020-02-20 | Sit,Pounce    |
+------+--------+---------+------------+---------------+
4 rows in set (0,00 sec)


mysql> select * from PackAnimals;
+------+---------+--------+------------+-----------------+
| id   | Name    | Type   | BirthDate  | Commands        |
+------+---------+--------+------------+-----------------+
|    1 | Thunder | Horse  | 2015-01-01 | Trot,Canter     |
|    2 | Sandy   | Camel  | 2016-05-15 | Walk,Sit        |
|    3 | Dune    | Camel  | 2018-12-10 | Sit             |
|    4 | Burro   | Donkey | 2019-02-20 | Sit,Pounce,Walk |
+------+---------+--------+------------+-----------------+
4 rows in set (0,00 sec)


- Удалить записи о верблюдах и объединить таблицы лошадей и ослов.


mysql> DELETE FROM PackAnimals WHERE Type ='Camel';
Query OK, 2 rows affected (0,00 sec)


mysql> select * from PackAnimals;
+------+---------+--------+------------+-----------------+
| id   | Name    | Type   | BirthDate  | Commands        |
+------+---------+--------+------------+-----------------+
|    1 | Thunder | Horse  | 2015-01-01 | Trot,Canter     |
|    4 | Burro   | Donkey | 2019-02-20 | Sit,Pounce,Walk |
+------+---------+--------+------------+-----------------+
2 rows in set (0,00 sec)

- Создать новую таблицу для животных в возрасте от 1 до 3 лет и вычислить
их возраст с точностью до месяца.

mysql> CREATE TABLE YoungAnimals (id INT, Name VARCHAR(50),Type VARCHAR(50), BirthDate DATE, Commands VARCHAR(250),Age VARCHAR(50));
Query OK, 0 rows affected (0,03 sec)


mysql> INSERT INTO YoungAnimals (id,Name,Type,BirthDate,Commands,Age) SELECT id,Name,Type,BirthDate,Commands,CONCAT(TIMESTAMPDIFF(YEAR,BirthDate,CURDATE()),' Age ',TIMESTAMPDIFF(MONTH,BirthDate,CURDATE()) %12, ' Month ') FROM Pets WHERE TIMESTAMPDIFF(YEAR, BirthDate, CURDATE()) BETWEEN 1 AND 2;
Query OK, 3 rows affected (0,01 sec)
Records: 3  Duplicates: 0  Warnings: 0

mysql> INSERT INTO YoungAnimals (id,Name,Type,BirthDate,Commands,Age) SELECT id,Name,Type,BirthDate,Commands,CONCAT(TIMESTAMPDIFF(YEAR,BirthDate,CURDATE()),' Age ',TIMESTAMPDIFF(MONTH,BirthDate,CURDATE()) %12, ' Month ') FROM PackAnimals WHERE TIMESTAMPDIFF(YEAR, BirthDate, CURDATE()) BETWEEN 1 AND 2;
Query OK, 0 rows affected (0,00 sec)
Records: 0  Duplicates: 0  Warnings: 0


mysql> select * from YoungAnimals;
+------+-------+---------+------------+----------+-----------------+
| id   | Name  | Type    | BirthDate  | Commands | Age             |
+------+-------+---------+------------+----------+-----------------+
|    3 | Begun | Hamster | 2021-12-10 | Sit      | 1 Age 11 Month  |
+------+-------+---------+------------+----------+-----------------+
1 row in set (0,00 sec)



mysql> SELECT id, Name,Type,BirthDate,Commands,NULL AS Age FROM Pets UNION SELECT id, Name,Type,BirthDate,Commands, NULL AS Age FROM PackAnimals UNION SELECT id, Name, Type, BirthDate, Commands, Age FROM YoungAnimals;
+------+---------+---------+------------+-----------------+-----------------+
| id   | Name    | Type    | BirthDate  | Commands        | Age             |
+------+---------+---------+------------+-----------------+-----------------+
|    1 | Fido    | Dog     | 2020-01-01 | Sit,StayFetch   | NULL            |
|    2 | Barsik  | Cat     | 2019-05-15 | Sit,Stay        | NULL            |
|    3 | Begun   | Hamster | 2021-12-10 | Sit             | NULL            |
|    4 | Smudge  | Cat     | 2020-02-20 | Sit,Pounce      | NULL            |
|    1 | Thunder | Horse   | 2015-01-01 | Trot,Canter     | NULL            |
|    4 | Burro   | Donkey  | 2019-02-20 | Sit,Pounce,Walk | NULL            |
|    3 | Begun   | Hamster | 2021-12-10 | Sit             | 1 Age 11 Month  |
+------+---------+---------+------------+-----------------+-----------------+
7 rows in set (0,00 sec)
